{
  "id": "t-2",
  "board_id": "b-1",
  "title": "Full",
  "description": "Desc",
  "status": "ready",
  "priority": 1,
  "assigned_worker_uid": "w-1",
  "parent_id": "t-0",
  "dependencies": [
    "t-3"
  ],
  "required_skills": [
    "rust"
  ],
  "is_rollup": true,
  "attempts": 2,
  "result_payload": {
    "nested": {
      "x": 1
    }
  },
  "block_reason": "waiting",
  "workspace_repo": "nio",
  "created_at": "2026-10-29T16:15:12.224Z",
  "updated_at": "2026-10-29T16:15:12.224Z",
  "started_at": "2026-10-29T16:15:12.224Z"
}
